{
  "goal": "Create CLI interface with ccmaid command supporting run, plan, and implement subcommands",
  "taskType": "edit",
  "editableFiles": ["maid_agents/maid_agents/cli/main.py"],
  "readonlyFiles": ["maid_agents/tests/test_task_012_cli_interface.py"],
  "expectedArtifacts": {
    "file": "maid_agents/maid_agents/cli/main.py",
    "contains": [
      {"type": "function", "name": "main", "args": [], "returns": "None"}
    ]
  },
  "validationCommand": ["pytest", "maid_agents/tests/test_task_012_cli_interface.py", "-v"]
}
